mapping,correspondences,transformations,preservations,bridges,semanticEffects,noDirectMappings,operatorAssisted,manualSteps,automatedSteps,manualRatio,riskScore,riskLevel,riskReasons
"Build Runtime and Gradual Migration","6","3","1","1","1","0","3","5","9","35.7%","5","MEDIUM","Transformation 'JUnit 4 Runtime to JUnit Vintage Engine': OperatorHelp (+1); Transformation 'JUnit 4 Build Dependencies to Jupiter Dependencies': OperatorHelp (+1); Bridge 'JUnit Vintage Engine Coexistence Bridge': Cleanup-required bridge (+1); SemanticEffect 'Vintage Engine Temporary and Deprecated Support': Support deprecated (+1); Transformation 'JUnit 4 Build Execution to JUnit Platform Execution': OperatorHelp (+1)"
"Core Test Annotation and Lifecycle Migration","10","7","2","0","1","0","3","7","17","29.2%","5","MEDIUM","Transformation '@Test Annotation to Jupiter @Test': OperatorHelp (+1); Transformation '@BeforeClass and @AfterClass to @BeforeAll and @AfterAll': OperatorHelp (+1); Transformation '@Ignore to @Disabled or Migration-Support IgnoreCondition': OperatorHelp (+1); Transformation '@Ignore to @Disabled or Migration-Support IgnoreCondition': Manual-heavy strategy (+1); SemanticEffect 'Test Member Visibility Requirement Relaxed': Default value changed (+1)"
"Assertions and Assumptions Migration","10","7","1","0","2","3","2","10","18","35.7%","15","HIGH","Transformation 'JUnit 4 Assert Imports to Jupiter Assertions': OperatorHelp (+1); Transformation 'Message-first Assertion Arguments to Message-last Assertion Arguments': OperatorHelp (+1); Transformation 'Assume.assumeNoException Approximation': NoDirectMapping (+3); Transformation 'Assume.assumeNotNull Approximation': NoDirectMapping (+3); Transformation 'Assume.assumeThat and Hamcrest Assumptions': NoDirectMapping (+3); Transformation 'Assume.assumeThat and Hamcrest Assumptions': Manual-heavy strategy (+1); SemanticEffect 'Failure Message Argument Order Changed': Configuration semantics changed (+1); SemanticEffect 'Matcher-Based Assumption Requires Validation': Validation required (+2)"
"Exception and Timeout Migration","7","4","1","0","2","0","4","15","9","62.5%","12","HIGH","Transformation '@Test(expected) to assertThrows': OperatorHelp (+1); Transformation '@Test(expected) to assertThrows': Manual-heavy strategy (+1); Transformation 'ExpectedException Rule to assertThrows or Migration Support': OperatorHelp (+1); Transformation 'ExpectedException Rule to assertThrows or Migration Support': Manual-heavy strategy (+1); Transformation '@Test(timeout) to Timeout Constructs': OperatorHelp (+1); Transformation '@Test(timeout) to Timeout Constructs': Manual-heavy strategy (+1); Transformation 'Timeout Rule to @Timeout or Timeout Assertions': OperatorHelp (+1); Transformation 'Timeout Rule to @Timeout or Timeout Assertions': Manual-heavy strategy (+1); SemanticEffect 'Expected Exception Attribute Removed From @Test': Support removed (+2); SemanticEffect 'Timeout Annotation Semantics Need Selection': Validation required (+2)"
"Rules ClassRules and Extension Model Migration","12","8","1","1","2","1","7","30","9","76.9%","22","HIGH","Transformation 'TemporaryFolder Rule to @TempDir': OperatorHelp (+1); Transformation 'ExternalResource Rule to Extension Callbacks': OperatorHelp (+1); Transformation 'ExternalResource Rule to Extension Callbacks': Manual-heavy strategy (+1); Transformation 'Verifier and ErrorCollector Rules': OperatorHelp (+1); Transformation 'Verifier and ErrorCollector Rules': Manual-heavy strategy (+1); Transformation 'ErrorCollector Rule to assertAll': OperatorHelp (+1); Transformation 'ErrorCollector Rule to assertAll': Manual-heavy strategy (+1); Transformation 'TestName Rule to TestInfo Parameter': OperatorHelp (+1); Transformation 'TestWatcher Rule to Jupiter TestWatcher Extension': OperatorHelp (+1); Transformation 'TestWatcher Rule to Jupiter TestWatcher Extension': Manual-heavy strategy (+1); Transformation 'Custom @Rule to @RegisterExtension or @ExtendWith': NoDirectMapping (+3); Transformation 'Custom @Rule to @RegisterExtension or @ExtendWith': Manual-heavy strategy (+1); Transformation '@ClassRule to Static @RegisterExtension or Class-Level Extension': OperatorHelp (+1); Transformation '@ClassRule to Static @RegisterExtension or Class-Level Extension': Manual-heavy strategy (+1); Bridge 'JUnit Jupiter Migration Support Bridge for Selected Rules': Cleanup-required bridge (+1); SemanticEffect 'JUnit 4 Rules Not Natively Supported By Jupiter': Support removed (+2); SemanticEffect 'Custom Rule Redesign Risk': Risk introduced (+3)"
"Runner Suite Category and Ordering Migration","18","15","0","0","3","2","11","34","18","65.4%","31","CRITICAL","Transformation 'General @RunWith to @ExtendWith': OperatorHelp (+1); Transformation 'General @RunWith to @ExtendWith': Manual-heavy strategy (+1); Transformation 'MockitoJUnitRunner to MockitoExtension': OperatorHelp (+1); Transformation 'SpringRunner to SpringExtension': OperatorHelp (+1); Transformation 'Custom Runner to Jupiter Extension Redesign': NoDirectMapping (+3); Transformation 'Custom Runner to Jupiter Extension Redesign': Manual-heavy strategy (+1); Transformation 'JUnit 4 Suite Runner to JUnit Platform Suite': OperatorHelp (+1); Transformation 'JUnit 4 Suite Runner to JUnit Platform Suite': Manual-heavy strategy (+1); Transformation 'Suite Selected Classes to SelectPackages': OperatorHelp (+1); Transformation 'Suite Selected Classes to SelectPackages': Manual-heavy strategy (+1); Transformation 'Categories to Tags': OperatorHelp (+1); Transformation 'Categories to Tags': Manual-heavy strategy (+1); Transformation 'Method-level Category to Method-level Tag': OperatorHelp (+1); Transformation '@FixMethodOrder to @TestMethodOrder': OperatorHelp (+1); Transformation '@FixMethodOrder to @TestMethodOrder': Manual-heavy strategy (+1); Transformation 'MethodSorters.DEFAULT Approximation': OperatorHelp (+1); Transformation 'MethodSorters.DEFAULT Approximation': Manual-heavy strategy (+1); Transformation 'MethodSorters.JVM Approximation': NoDirectMapping (+3); Transformation 'MethodSorters.JVM Approximation': Manual-heavy strategy (+1); Transformation 'SpringRunner to SpringExtension': OperatorHelp (+1); Transformation 'MockitoJUnitRunner to MockitoExtension': OperatorHelp (+1); SemanticEffect 'JUnit 4 Runners Not Natively Supported By Jupiter': Support removed (+2); SemanticEffect 'Category Marker Interfaces Become String Tags': Behavior change (+2); SemanticEffect 'Method Orderer Approximation Requires Validation': Validation required (+2)"
"Parameterized Theories and Advanced Test Forms","10","8","0","0","2","1","4","15","9","62.5%","18","HIGH","Transformation 'JUnit 4 Parameterized Runner to Jupiter @ParameterizedTest': OperatorHelp (+1); Transformation 'JUnit 4 Parameterized Runner to Jupiter @ParameterizedTest': Manual-heavy strategy (+1); Transformation '@Parameters factory to @MethodSource': OperatorHelp (+1); Transformation '@Parameters factory to @MethodSource': Manual-heavy strategy (+1); Transformation '@Parameter field injection to method parameters': OperatorHelp (+1); Transformation '@Parameter field injection to method parameters': Manual-heavy strategy (+1); Transformation 'JUnit 4 Theories to Jupiter Parameterized or Dynamic Tests': NoDirectMapping (+3); Transformation 'JUnit 4 Theories to Jupiter Parameterized or Dynamic Tests': Manual-heavy strategy (+1); Transformation 'JUnit 4 Parameterized Class to Jupiter @ParameterizedClass': OperatorHelp (+1); Transformation '@BeforeParam to @BeforeParameterizedClassInvocation': Missing strategy (+1); Transformation '@AfterParam to @AfterParameterizedClassInvocation': Missing strategy (+1); Transformation '@Parameter to Jupiter Parameter': Missing strategy (+1); SemanticEffect 'Parameterized Runner Migration May Restructure Test Shape': Behavior change (+2); SemanticEffect 'Theories Have No Direct Jupiter Equivalent': Support removed (+2)"
"Legacy TestCase and Tool-Assisted Migration","3","2","0","0","1","0","1","2","5","28.6%","3","LOW","Transformation 'JUnit 4 TestCase Inheritance to Annotation-Based Jupiter Tests': OperatorHelp (+1); SemanticEffect 'Automated Tooling Has Partial Coverage': Validation required (+2)"
